{
  "id": "lecture_id",
  "block": "5e",
  "title": "Lecture Title",
  "subtitle": "Lecture subtitle",
  "source_pdf": "assets/pdfs/lecture_id.pdf",
  "source_pages": [1, 2, 3],
  "summary": [
    "Primary point one",
    "Primary point two",
    "Primary point three"
  ],
  "exam_focus": [
    "High-yield exam point",
    "Another exam-focused point"
  ],
  "sections": [
    {
      "id": "lecture_id_s01",
      "title": "Section title",
      "kind": "reading",
      "content": [
        {
          "type": "paragraph",
          "text": "Lecture paragraph text."
        },
        {
          "type": "bullet_group",
          "items": [
            {
              "text": "Main bullet",
              "children": [
                "Sub bullet"
              ]
            }
          ]
        }
      ],
      "visual_refs": ["visual_id"],
      "quiz_refs": ["quiz_id"],
      "glossary_refs": ["term_id"],
      "question_refs": ["question_id"]
    }
  ],
  "related_exam_set_ids": ["exam_set_id"]
}

